{
  "meta": {
    "schema_version": "2",
    "dataset_version": "2026-07-16_KDRG_V47_PILOT_SPECIAL_CASES_V2",
    "kdrg_version": "KDRG V4.7",
    "effective_date": "2024-01-01",
    "correction_cutoff_date": "2026-05-01",
    "data_scope": "V4.7 특이케이스 파일럿 · MDC 04/05 · 9개 ADRG · 스키마 v2 병렬검증용",
    "generated_at": "2026-07-16T00:30:37Z",
    "generated_by": "tools/convert_pilot_v1_to_v2.py",
    "source_manifest_version": "1",
    "runtime_status": "PILOT_PARALLEL_VALIDATION",
    "notes": "현재 runtime 데이터(kdrg_v47_ui_fixture.json)는 교체하지 않음. 의미 동일성 검증 전용."
  },
  "sources": [
    {
      "source_id": "V47_MAIN_PDF",
      "source_type": "BASE_MANUAL_PDF",
      "file_name": "KDRG_V4.7_분류집_1784091626702.pdf",
      "title": "KDRG V4.7 분류집 (1,282쪽)",
      "effective_date": "2024-01-01",
      "correction_cutoff_date": null,
      "authority": "건강보험심사평가원",
      "usage_scope": "ADRG 조건식, TABLE 소속, 조건문 원전",
      "sha256": null,
      "included_in_runtime": false,
      "notes": "TABLE 소속·조건식 구조의 최종 근거 문서"
    },
    {
      "source_id": "V47_APPENDIX_PDF",
      "source_type": "APPENDIX_PDF",
      "file_name": "KDRG_V4.7_분류집_부록_1784091626703.pdf",
      "title": "KDRG V4.7 분류집 부록 (776쪽)",
      "effective_date": "2024-01-01",
      "correction_cutoff_date": null,
      "authority": "건강보험심사평가원",
      "usage_scope": "교차검증 전용. TABLE 소속 신규 근거로 단독 사용 금지",
      "sha256": null,
      "included_in_runtime": false,
      "notes": null
    },
    {
      "source_id": "V47_CORR_20260501_HWPX",
      "source_type": "CORRECTION_HWPX",
      "file_name": "KDRG_일반용(V4.7)_교정표_20260501_1784091626703.hwpx",
      "title": "KDRG 일반용(V4.7) 교정표 2026-05-01",
      "effective_date": "2026-05-01",
      "correction_cutoff_date": "2026-05-01",
      "authority": "건강보험심사평가원",
      "usage_scope": "분류집 본문 교정. 본문과 충돌 시 교정표 우선",
      "sha256": null,
      "included_in_runtime": false,
      "notes": null
    },
    {
      "source_id": "V47_CORR_20260301_HWPX",
      "source_type": "CORRECTION_HWPX",
      "file_name": "KDRG_일반용(V4.7)_교정표_20260301",
      "title": "KDRG 일반용(V4.7) 교정표 2026-03-01",
      "effective_date": "2026-03-01",
      "correction_cutoff_date": "2026-03-01",
      "authority": "건강보험심사평가원",
      "usage_scope": "F022 M6586 table6 추가 교정",
      "sha256": null,
      "included_in_runtime": false,
      "notes": "F022 시술명 table6(M6586) 독립 경로 추가"
    },
    {
      "source_id": "V47_PROC_MASTER_XLSX",
      "source_type": "PROCEDURE_MASTER_XLSX",
      "file_name": "KDRG_일반용(V4.7)_시술_등_목록_20260501_1784091626703.xlsx",
      "title": "KDRG 일반용(V4.7) 시술 등 목록 (2,791행)",
      "effective_date": "2026-05-01",
      "correction_cutoff_date": null,
      "authority": "건강보험심사평가원",
      "usage_scope": "코드 존재 및 공식 명칭 확인 전용. TABLE 소속 판단에 단독 사용 금지",
      "sha256": null,
      "included_in_runtime": false,
      "notes": null
    },
    {
      "source_id": "V47_GROUP_NAME_XLSX",
      "source_type": "GROUP_NAME_MASTER_XLSX",
      "file_name": "KDRG_일반용(V4.7)_질병군명칭(변동없음)_1784091626704.xlsx",
      "title": "KDRG 일반용(V4.7) 질병군명칭 (2,700행)",
      "effective_date": "2024-01-01",
      "correction_cutoff_date": null,
      "authority": "건강보험심사평가원",
      "usage_scope": "ADRG/AADRG/RDRG 명칭 표준 표기",
      "sha256": null,
      "included_in_runtime": false,
      "notes": null
    },
    {
      "source_id": "V47_ABC_PDF",
      "source_type": "ABC_REGULATION_PDF",
      "file_name": "[별표_1]_입원환자의_질병군별_질병의_종류(제3조제1항_관련)(상급종합병원의_지정_및_평가_규정)_(2)_1784091626701.pdf",
      "title": "[별표 1] 입원환자의 질병군별 질병의 종류 최신 고시본 (31쪽)",
      "effective_date": "2024-01-01",
      "correction_cutoff_date": null,
      "authority": "보건복지부",
      "usage_scope": "A/B/C 질병군 분류의 유일한 공식 원천. AADRG 코드 정확일치만 공식 적용",
      "sha256": null,
      "included_in_runtime": false,
      "notes": "구 HWP/HWPX 기반 A/B/C 자료 사용 금지"
    }
  ],
  "mdc_master": [
    {
      "mdc": "04",
      "name": "호흡기계",
      "aliases": [
        "MDC 04",
        "MDC04",
        "호흡기계",
        "Diseases and Disorders of the Respiratory System"
      ]
    },
    {
      "mdc": "05",
      "name": "순환기계",
      "aliases": [
        "MDC 05",
        "MDC05",
        "순환기계",
        "Diseases and Disorders of the Circulatory System"
      ]
    }
  ],
  "tables": [
    {
      "table_id": "V47_E04_E011_PROC_1",
      "owner_adrg": "E011",
      "printed_label": "시술명 table1",
      "display_label": "시술명 table1",
      "table_role": "PROCEDURE",
      "code_type": "수술·처치코드",
      "source_refs": [
        {
          "source_id": "V47_MAIN_PDF",
          "printed_page": "264",
          "pdf_page": 290,
          "section": null,
          "table_label": null,
          "excerpt": null,
          "evidence_type": "RULE_TEXT"
        }
      ],
      "member_count": 13,
      "members": [
        {
          "code": "O1311",
          "name_ko_raw": "기관또는기관지종양제거술(경부접근)-기관절제및재건술",
          "name_ko_effective": "기관또는기관지종양제거술(경부접근)-기관절제및재건술",
          "name_en_raw": "",
          "name_en_effective": "",
          "original_order": 1,
          "source_refs": [],
          "correction_refs": [],
          "status": "ACTIVE"
        },
        {
          "code": "O1312",
          "name_ko_raw": "기관또는기관지종양제거술(경부접근)-기관절제및성형술",
          "name_ko_effective": "기관또는기관지종양제거술(경부접근)-기관절제및성형술",
          "name_en_raw": "",
          "name_en_effective": "",
          "original_order": 2,
          "source_refs": [],
          "correction_refs": [],
          "status": "ACTIVE"
        },
        {
          "code": "O1313",
          "name_ko_raw": "기관또는기관지종양제거술(흉부접근)-기관(지)절제및재건술",
          "name_ko_effective": "기관또는기관지종양제거술(흉부접근)-기관(지)절제및재건술",
          "name_en_raw": "",
          "name_en_effective": "",
          "original_order": 3,
          "source_refs": [],
          "correction_refs": [],
          "status": "ACTIVE"
        },
        {
          "code": "O1314",
          "name_ko_raw": "기관또는기관지종양제거술(흉부접근)-기관(지)절제및성형술",
          "name_ko_effective": "기관또는기관지종양제거술(흉부접근)-기관(지)절제및성형술",
          "name_en_raw": "",
          "name_en_effective": "",
          "original_order": 4,
          "source_refs": [],
          "correction_refs": [],
          "status": "ACTIVE"
        },
        {
          "code": "O1317",
          "name_ko_raw": "기관또는기관지종양제거술(흉부접근)-기관분기부 절제 및 재건술",
          "name_ko_effective": "기관또는기관지종양제거술(흉부접근)-기관분기부 절제 및 재건술",
          "name_en_raw": "",
          "name_en_effective": "",
          "original_order": 5,
          "source_refs": [],
          "correction_refs": [],
          "status": "ACTIVE"
        },
        {
          "code": "O1336",
          "name_ko_raw": "개흉적기관또는기관지이물제거술",
          "name_ko_effective": "개흉적기관또는기관지이물제거술",
          "name_en_raw": "",
          "name_en_effective": "",
          "original_order": 6,
          "source_refs": [],
          "correction_refs": [],
          "status": "ACTIVE"
        },
        {
          "code": "O1341",
          "name_ko_raw": "기관또는기관지협착증수술(경부접근)-기관절제및재건술",
          "name_ko_effective": "기관또는기관지협착증수술(경부접근)-기관절제및재건술",
          "name_en_raw": "",
          "name_en_effective": "",
          "original_order": 7,
          "source_refs": [],
          "correction_refs": [],
          "status": "ACTIVE"
        },
        {
          "code": "O1342",
          "name_ko_raw": "기관또는기관지협착증수술(경부접근)-기관절제및성형술",
          "name_ko_effective": "기관또는기관지협착증수술(경부접근)-기관절제및성형술",
          "name_en_raw": "",
          "name_en_effective": "",
          "original_order": 8,
          "source_refs": [],
          "correction_refs": [],
          "status": "ACTIVE"
        },
        {
          "code": "O1344",
          "name_ko_raw": "기관또는기관지협착증수술(흉부접근)-기관(지)절제및재건술",
          "name_ko_effective": "기관또는기관지협착증수술(흉부접근)-기관(지)절제및재건술",
          "name_en_raw": "",
          "name_en_effective": "",
          "original_order": 9,
          "source_refs": [],
          "correction_refs": [],
          "status": "ACTIVE"
        },
        {
          "code": "O1345",
          "name_ko_raw": "기관또는기관지협착증수술(흉부접근)-기관(지)절제및성형술",
          "name_ko_effective": "기관또는기관지협착증수술(흉부접근)-기관(지)절제및성형술",
          "name_en_raw": "",
          "name_en_effective": "",
          "original_order": 10,
          "source_refs": [],
          "correction_refs": [],
          "status": "ACTIVE"
        },
        {
          "code": "O1352",
          "name_ko_raw": "기관지식도루폐쇄술",
          "name_ko_effective": "기관지식도루폐쇄술",
          "name_en_raw": "",
          "name_en_effective": "",
          "original_order": 11,
          "source_refs": [],
          "correction_refs": [],
          "status": "ACTIVE"
        },
        {
          "code": "O1353",
          "name_ko_raw": "기관지담도루폐쇄술",
          "name_ko_effective": "기관지담도루폐쇄술",
          "name_en_raw": "",
          "name_en_effective": "",
          "original_order": 12,
          "source_refs": [],
          "correction_refs": [],
          "status": "ACTIVE"
        },
        {
          "code": "O1354",
          "name_ko_raw": "기관지대동정맥루폐쇄술",
          "name_ko_effective": "기관지대동정맥루폐쇄술",
          "name_en_raw": "",
          "name_en_effective": "",
          "original_order": 13,
          "source_refs": [],
          "correction_refs": [],
          "status": "ACTIVE"
        }
      ],
      "derivation": null,
      "status": "ACTIVE"
    },
    {
      "table_id": "V47_E04_E011_PROC_2",
      "owner_adrg": "E011",
      "printed_label": "시술명 table2",
      "display_label": "시술명 table2",
      "table_role": "PROCEDURE",
      "code_type": "수술·처치코드",
      "source_refs": [
        {
          "source_id": "V47_MAIN_PDF",
          "printed_page": "264",
          "pdf_page": 290,
          "section": null,
          "table_label": null,
          "excerpt": null,
          "evidence_type": "RULE_TEXT"
        }
      ],
      "member_count": 2,
      "members": [
        {
          "code": "O1326",
          "name_ko_raw": "기관또는기관지봉합술(흉부접근)",